{
  "entries": [
    {
      "algorithm": "Ed25519",
      "alias": "alias/telli-legal-reviewer-01",
      "createdAt": "2026-07-29T06:50:51Z",
      "displayName": "Av. Fatma Uluca Telli",
      "fingerprint": "bb35e308e429124c5cd2865930d926de5cd43a7caf2cc4e690505bbe228b0f34",
      "fingerprintAlgorithm": "SHA-256",
      "keyUsage": "SIGN_VERIFY",
      "provider": "AWS_KMS",
      "publicKey": "MCowBQYDK2VwAyEA4p1lyqpSkyQ5kFjKgqeq3xA9MTCkEQmHOzamYS4CHMg=",
      "publicKeyEncoding": "BASE64",
      "publicKeyFormat": "SPKI_DER",
      "region": "eu-central-1",
      "revocationPolicyId": "RCV-CLAIM-LEGAL-SIGNER-REVOCATION-POLICY@1",
      "role": "LEGAL_REVIEWER",
      "rotationPolicyId": "RCV-CLAIM-LEGAL-SIGNER-ROTATION-POLICY@1",
      "signerId": "TELLI-LEGAL-REVIEWER-01",
      "signingAlgorithm": "ED25519_SHA_512",
      "signingAuthorityStatus": "NOT_ACTIVE",
      "status": "ENABLED",
      "subjectType": "HUMAN",
      "trustRootStatus": "PENDING_ONBOARDING"
    },
    {
      "algorithm": "Ed25519",
      "alias": "alias/telli-final-legal-ratifier-01",
      "createdAt": "2026-07-29T06:52:41Z",
      "displayName": "Av. Ulaş Hüseyin Telli",
      "fingerprint": "1da0f683f9922cb564544e5d31633aacb5c3bbdc53b15f6c6c96cb6925a61e40",
      "fingerprintAlgorithm": "SHA-256",
      "keyUsage": "SIGN_VERIFY",
      "provider": "AWS_KMS",
      "publicKey": "MCowBQYDK2VwAyEAmW71eurfgCUya/BeSRxTs66Yj4MekXC/0v8wMT3J1v4=",
      "publicKeyEncoding": "BASE64",
      "publicKeyFormat": "SPKI_DER",
      "region": "eu-central-1",
      "revocationPolicyId": "RCV-CLAIM-LEGAL-SIGNER-REVOCATION-POLICY@1",
      "role": "FINAL_LEGAL_RATIFIER",
      "rotationPolicyId": "RCV-CLAIM-LEGAL-SIGNER-ROTATION-POLICY@1",
      "signerId": "TELLI-FINAL-LEGAL-RATIFIER-01",
      "signingAlgorithm": "ED25519_SHA_512",
      "signingAuthorityStatus": "NOT_ACTIVE",
      "status": "ENABLED",
      "subjectType": "HUMAN",
      "trustRootStatus": "PENDING_ONBOARDING"
    },
    {
      "algorithm": "Ed25519",
      "alias": "alias/telli-prod-legal-01",
      "createdAt": "2026-07-29T06:52:46Z",
      "displayName": "Telli Legal Release Service",
      "fingerprint": "88cd9f1bdb50f57bc6a7496f9b94136bfbf4658888b5d82f933f3b5fb0537314",
      "fingerprintAlgorithm": "SHA-256",
      "keyUsage": "SIGN_VERIFY",
      "provider": "AWS_KMS",
      "publicKey": "MCowBQYDK2VwAyEA626BJiW9j466gX6u0Pw62WB+S+OF6LPU1qJawCfJIJU=",
      "publicKeyEncoding": "BASE64",
      "publicKeyFormat": "SPKI_DER",
      "region": "eu-central-1",
      "revocationPolicyId": "RCV-CLAIM-LEGAL-SIGNER-REVOCATION-POLICY@1",
      "role": "PRODUCTION_RELEASE_SIGNER",
      "rotationPolicyId": "RCV-CLAIM-LEGAL-SIGNER-ROTATION-POLICY@1",
      "signerId": "TELLI-PROD-LEGAL-01",
      "signingAlgorithm": "ED25519_SHA_512",
      "signingAuthorityStatus": "NOT_ACTIVE",
      "status": "ENABLED",
      "subjectType": "SERVICE",
      "trustRootStatus": "PENDING_ONBOARDING"
    }
  ],
  "keyCount": 3,
  "manifestId": "RCV-CLAIM-LEGAL-SIGNER-PUBLIC-KEY-MANIFEST",
  "manifestVersion": 1,
  "privateEvidence": {
    "checksumAlgorithm": "SHA-256",
    "evidenceSetChecksum": "03fd483d4c452c4e40516a33504f0c09c4a8802ed370120720a52fea4869d2b0",
    "recordId": "KC01-AWS-PRIVATE-OPERATIONAL-EVIDENCE"
  },
  "productionSignatureStatus": "NONE",
  "provider": "AWS_KMS",
  "region": "eu-central-1",
  "serializationAlgorithm": "RCV-CLAIM-LEGAL-SIGNER-PUBLIC-KEY-MANIFEST-CANONICAL-JSON-V1",
  "signingAuthorityStatus": "NOT_ACTIVE",
  "status": "RATIFIED",
  "trustRootStatus": "PENDING_ONBOARDING"
}
